[
  {
    "key": "2020-08-24T21:57:28+0000_c9b8469ee8022ca581573f863fc12f8e142ca4b5",
    "date": "2020-08-24T21:57:28+0000",
    "commit": "c9b8469ee8022ca581573f863fc12f8e142ca4b5",
    "errors": 3
  },
  {
    "key": "2020-09-08T15:00:34+0000_4396d619e2abc22fab76e7466a77dfc0b9323dd2",
    "date": "2020-09-08T15:00:34+0000",
    "commit": "4396d619e2abc22fab76e7466a77dfc0b9323dd2",
    "errors": 1
  },
  {
    "key": "2020-08-25T01:10:19+0000_c9b8469ee8022ca581573f863fc12f8e142ca4b5",
    "date": "2020-08-25T01:10:19+0000",
    "commit": "c9b8469ee8022ca581573f863fc12f8e142ca4b5",
    "errors": 2
  },
  {
    "key": "2020-08-25T13:42:29+0000_c9b8469ee8022ca581573f863fc12f8e142ca4b5",
    "date": "2020-08-25T13:42:29+0000",
    "commit": "c9b8469ee8022ca581573f863fc12f8e142ca4b5",
    "errors": 2
  },
  {
    "key": "2020-08-26T12:35:54+0000_354de73f85a082ad3c0b9efcb1d502e34aebb36b",
    "date": "2020-08-26T12:35:54+0000",
    "commit": "354de73f85a082ad3c0b9efcb1d502e34aebb36b",
    "errors": 1
  },
  {
    "key": "2020-09-01T13:35:24+0000_9403ea647d7e5f08fff38bf9110978d3df2348d5",
    "date": "2020-09-01T13:35:24+0000",
    "commit": "9403ea647d7e5f08fff38bf9110978d3df2348d5",
    "errors": 0
  },
  {
    "key": "2020-09-01T14:35:51+0000_c11553adf94de3325229bdc817cdc904981d10e0",
    "date": "2020-09-01T14:35:51+0000",
    "commit": "c11553adf94de3325229bdc817cdc904981d10e0",
    "errors": 0
  },
  {
    "key": "2020-09-01T20:41:11+0000_c11553adf94de3325229bdc817cdc904981d10e0",
    "date": "2020-09-01T20:41:11+0000",
    "commit": "c11553adf94de3325229bdc817cdc904981d10e0",
    "errors": 0
  },
  {
    "key": "2020-09-01T22:28:34+0000_c11553adf94de3325229bdc817cdc904981d10e0",
    "date": "2020-09-01T22:28:34+0000",
    "commit": "c11553adf94de3325229bdc817cdc904981d10e0",
    "errors": 0
  },
  {
    "key": "2020-09-02T21:21:25+0000_c11553adf94de3325229bdc817cdc904981d10e0",
    "date": "2020-09-02T21:21:25+0000",
    "commit": "c11553adf94de3325229bdc817cdc904981d10e0",
    "errors": 3
  },
  {
    "key": "2020-09-03T14:41:56+0000_28858766da57f9c672414c0d55995a2b05748383",
    "date": "2020-09-03T14:41:56+0000",
    "commit": "28858766da57f9c672414c0d55995a2b05748383",
    "errors": 3
  },
  {
    "key": "2020-09-04T20:46:14+0000_5dcfdd40d31d594b9273ceef4077048da6528d7b",
    "date": "2020-09-04T20:46:14+0000",
    "commit": "5dcfdd40d31d594b9273ceef4077048da6528d7b",
    "errors": 5
  },
  {
    "key": "2020-09-10T14:30:22+0000_5dcfdd40d31d594b9273ceef4077048da6528d7b_b7ed092934b9225cb96572a7c52fa9a4",
    "date": "2020-09-10T14:30:22+0000",
    "commit": "5dcfdd40d31d594b9273ceef4077048da6528d7b",
    "hash": "b7ed092934b9225cb96572a7c52fa9a4",
    "errors": 1
  },
  {
    "key": "2020-09-10T22:10:52+0000_c664b7f4998c41a2a76f972fbd96f236df7e3285_ed8cb023fe1e5209275dca33f9a94554",
    "date": "2020-09-10T22:10:52+0000",
    "commit": "c664b7f4998c41a2a76f972fbd96f236df7e3285",
    "hash": "ed8cb023fe1e5209275dca33f9a94554",
    "errors": 3
  },
  {
    "key": "2020-09-14T15:38:04+0000_b84870df050b628ba25e5862a312922059e3563a_6390ac1d0e1f1487b7d9bfdcd0ba16b0",
    "date": "2020-09-14T15:38:04+0000",
    "commit": "b84870df050b628ba25e5862a312922059e3563a",
    "hash": "6390ac1d0e1f1487b7d9bfdcd0ba16b0",
    "errors": 0
  },
  {
    "key": "2020-09-14T23:39:50+0000_1ad067ca7f7cfd13fdc5c7ebbe698774d73533ce_250c7c5d0b09bb84c30b0b7bf6c741ea",
    "date": "2020-09-14T23:39:50+0000",
    "commit": "1ad067ca7f7cfd13fdc5c7ebbe698774d73533ce",
    "hash": "250c7c5d0b09bb84c30b0b7bf6c741ea",
    "errors": 1
  },
  {
    "key": "2020-09-18T20:37:10+0000_8fa686abbb3ed01bf101257cbb1bcf0617658af6_a2fe4b64d90b984029e598ebcf6ce8e5",
    "date": "2020-09-18T20:37:10+0000",
    "commit": "8fa686abbb3ed01bf101257cbb1bcf0617658af6",
    "hash": "a2fe4b64d90b984029e598ebcf6ce8e5",
    "errors": 0
  },
  {
    "key": "2020-09-24T21:37:50+0000_e2281728495be03208101f21f0c59ee504ecc407_a873d12c6bf2290aec54117dcc7947e4",
    "date": "2020-09-24T21:37:50+0000",
    "commit": "e2281728495be03208101f21f0c59ee504ecc407",
    "hash": "a873d12c6bf2290aec54117dcc7947e4",
    "errors": 0
  },
  {
    "key": "2020-09-25T21:08:25+0000_e2281728495be03208101f21f0c59ee504ecc407_a873d12c6bf2290aec54117dcc7947e4",
    "date": "2020-09-25T21:08:25+0000",
    "commit": "e2281728495be03208101f21f0c59ee504ecc407",
    "hash": "a873d12c6bf2290aec54117dcc7947e4",
    "errors": 5
  },
  {
    "key": "2020-09-25T23:39:48+0000_041cdc6342b59c6d65cbcf8483940068cc195ab7_5874e9162431e71ab92c66eb47fd1f57",
    "date": "2020-09-25T23:39:48+0000",
    "commit": "041cdc6342b59c6d65cbcf8483940068cc195ab7",
    "hash": "5874e9162431e71ab92c66eb47fd1f57",
    "errors": 3
  },
  {
    "key": "2020-09-28T12:39:02+0000_2445a86df6d2a736ee36f07252905eaa5372f8bf_124547e4a174f38d5da3faba00709738",
    "date": "2020-09-28T12:39:02+0000",
    "commit": "2445a86df6d2a736ee36f07252905eaa5372f8bf",
    "hash": "124547e4a174f38d5da3faba00709738",
    "errors": 1
  },
  {
    "key": "2020-09-29T14:49:40+0000_faa4a306967d4dd949df99ac4d8db88ef4451992_1167e7937b536c1948fa94bc21577c1f",
    "date": "2020-09-29T14:49:40+0000",
    "commit": "faa4a306967d4dd949df99ac4d8db88ef4451992",
    "hash": "1167e7937b536c1948fa94bc21577c1f",
    "errors": 1
  },
  {
    "key": "2020-10-02T03:41:41+0000_d44db531d915ea3057a9f0955a1804e779d36ed6_171fddb8dda2acfa7257cf7ad19cf74b",
    "date": "2020-10-02T03:41:41+0000",
    "commit": "d44db531d915ea3057a9f0955a1804e779d36ed6",
    "hash": "171fddb8dda2acfa7257cf7ad19cf74b",
    "errors": 3
  },
  {
    "key": "2020-10-07T01:38:24+0000_0799a2ce906d85ec150c242b69485aa849c5b75c_66609b078038cc776641afe2e3b3cee8",
    "date": "2020-10-07T01:38:24+0000",
    "commit": "0799a2ce906d85ec150c242b69485aa849c5b75c",
    "hash": "66609b078038cc776641afe2e3b3cee8",
    "errors": 1
  },
  {
    "key": "2020-10-07T14:38:23+0000_e88ab1d61bc19ececb75a2089d0232847965f0d6_555e14e4b77375e744376d01ba3fe13b",
    "date": "2020-10-07T14:38:23+0000",
    "commit": "e88ab1d61bc19ececb75a2089d0232847965f0d6",
    "hash": "555e14e4b77375e744376d01ba3fe13b",
    "errors": 10
  },
  {
    "key": "2020-10-08T14:39:16+0000_3f35c16b60285c94bd9e227a431a5a707351af69_9c0e6ec7f8a2eca77f132137b66039d9",
    "date": "2020-10-08T14:39:16+0000",
    "commit": "3f35c16b60285c94bd9e227a431a5a707351af69",
    "hash": "9c0e6ec7f8a2eca77f132137b66039d9",
    "errors": 3
  },
  {
    "key": "2020-10-09T12:42:34+0000_343eee8411502318a3340d959dbdbacb33494a10_30c1d5939211598643bced9905894488",
    "date": "2020-10-09T12:42:34+0000",
    "commit": "343eee8411502318a3340d959dbdbacb33494a10",
    "hash": "30c1d5939211598643bced9905894488",
    "errors": 0
  },
  {
    "key": "2020-10-09T15:18:30+0000_343eee8411502318a3340d959dbdbacb33494a10_30c1d5939211598643bced9905894488",
    "date": "2020-10-09T15:18:30+0000",
    "commit": "343eee8411502318a3340d959dbdbacb33494a10",
    "hash": "30c1d5939211598643bced9905894488",
    "errors": 1
  },
  {
    "key": "2020-10-10T14:37:19+0000_1a94e070dea037d8e6cad635a3e709b5059c9328_7864aa23b0798357fbf6be59f786feca",
    "date": "2020-10-10T14:37:19+0000",
    "commit": "1a94e070dea037d8e6cad635a3e709b5059c9328",
    "hash": "7864aa23b0798357fbf6be59f786feca",
    "errors": 3
  },
  {
    "key": "2020-10-13T05:43:27+0000_efc389a71f090d3657c8fd5721ba818ebbeebc4e_4231dbc28b6de7a69c36769167048f48",
    "date": "2020-10-13T05:43:27+0000",
    "commit": "efc389a71f090d3657c8fd5721ba818ebbeebc4e",
    "hash": "4231dbc28b6de7a69c36769167048f48",
    "errors": 2
  },
  {
    "key": "2020-10-13T21:37:36+0000_6c7fce0669f77a792b04bf3f3eb388f5420b02ad_eef25651ec46327885f10d14f161ec55",
    "date": "2020-10-13T21:37:36+0000",
    "commit": "6c7fce0669f77a792b04bf3f3eb388f5420b02ad",
    "hash": "eef25651ec46327885f10d14f161ec55",
    "errors": 2
  },
  {
    "key": "2020-10-14T13:41:43+0000_656ae60212e73eb07bd4ce1aadbcb8b50a5f9802_709d8d7f341b7e398b90eb4cf642f9f4",
    "date": "2020-10-14T13:41:43+0000",
    "commit": "656ae60212e73eb07bd4ce1aadbcb8b50a5f9802",
    "hash": "709d8d7f341b7e398b90eb4cf642f9f4",
    "errors": 2
  },
  {
    "key": "2020-10-14T19:38:33+0000_d541ef5f192e327ea21f963260c53ef217cfe75b_3fa686d2857911f4fc6fb4860c689b17",
    "date": "2020-10-14T19:38:33+0000",
    "commit": "d541ef5f192e327ea21f963260c53ef217cfe75b",
    "hash": "3fa686d2857911f4fc6fb4860c689b17",
    "errors": 1
  },
  {
    "key": "2020-10-16T02:38:03+0000_07cb8da24bb8da9d49bd3a586020899daaaa3922_5df28e2e83520100fd9853dc20b0705d",
    "date": "2020-10-16T02:38:03+0000",
    "commit": "07cb8da24bb8da9d49bd3a586020899daaaa3922",
    "hash": "5df28e2e83520100fd9853dc20b0705d",
    "errors": 1
  },
  {
    "key": "2020-10-17T23:37:24+0000_5227b9698b8ccc6f84a1ce59da7c151d2bc9979e_ab14b3d0da9602427940fc3b5708779f",
    "date": "2020-10-17T23:37:24+0000",
    "commit": "5227b9698b8ccc6f84a1ce59da7c151d2bc9979e",
    "hash": "ab14b3d0da9602427940fc3b5708779f",
    "errors": 0
  },
  {
    "key": "2020-10-20T14:24:42+0000_5227b9698b8ccc6f84a1ce59da7c151d2bc9979e_ab14b3d0da9602427940fc3b5708779f",
    "date": "2020-10-20T14:24:42+0000",
    "commit": "5227b9698b8ccc6f84a1ce59da7c151d2bc9979e",
    "hash": "ab14b3d0da9602427940fc3b5708779f",
    "errors": 0
  },
  {
    "key": "2020-10-20T20:13:12+0000_5227b9698b8ccc6f84a1ce59da7c151d2bc9979e_ab14b3d0da9602427940fc3b5708779f",
    "date": "2020-10-20T20:13:12+0000",
    "commit": "5227b9698b8ccc6f84a1ce59da7c151d2bc9979e",
    "hash": "ab14b3d0da9602427940fc3b5708779f",
    "errors": 0
  },
  {
    "key": "2020-10-21T14:04:30+0000_dff7dd993f318178d7f33614fe9326a425de2b2d_47b53bd0c9075419f94a0bb0d97137ee",
    "date": "2020-10-21T14:04:30+0000",
    "commit": "dff7dd993f318178d7f33614fe9326a425de2b2d",
    "hash": "47b53bd0c9075419f94a0bb0d97137ee",
    "errors": 2
  },
  {
    "key": "2020-10-22T23:37:51+0000_74078cb2b34af0ab8118951066353413f41aee3b_a9f49c4dcf9b9e1eddb0f678edb2ce9d",
    "date": "2020-10-22T23:37:51+0000",